content,question,answer
"JAKARTA, KOMPAS.com-Kejaksaan Agungtelah mengajukan permohonan ekstradisi kepada eks Staf Khusus (Stafsus) Mendikbudristek eraNadiem Makarim,Jurist Tanyang kini telah ditetapkan sebagai salah satu tersangka kasus dugaan korupsi pengadaan laptop berbasisChromebook.
“Sudah diajukan ekstradisi,” ujar Jaksa Agung Muda Tindak Pidana Khusus (Jampidsus) Kejagung Febrie Adriansyah saat dikonfirmasi, Selasa (22/7/2025).
Sejauh ini, penyidik belum menjelaskan lebih lanjut terkait posisi Jurist Tan. Tapi, Jurist diketahui sudah pernah dipanggil sebagai tersangka pada Jumat (18/7/2025).
Baca juga:Jurist Tan Berkali-kali Mangkir, Apa Langkah yang Akan Diambil Kejagung?
Namun pada saat itu Jurist kembali mangkir dari panggilan penyidik.
Saat ini, ada empat orang yang telah ditetapkan sebagai tersangka dalam kasus dugaan korupsi pengadaan laptop berbasis Chromebook.
Mereka adalah eks Stafsus Mendikbudristek era Nadiem Makarim periode 2020-2024, Jurist Tan; Eks Konsultan Teknologi di lingkungan Kemendikbudristek, Ibrahim Arief.
Lalu, Direktur SMP pada Direktorat Jenderal Pendidikan Anak Usia Dini, Pendidikan Dasar, dan Pendidikan Menengah Kemendikbudristek Tahun 2020-2021 sekaligus KPA di Lingkungan Direktorat Sekolah Menengah Pertama Tahun Anggaran 2020-2021, Mulyatsyah.
Baca juga:Eks Stafsus Nadiem Jurist Tan Mangkir Lagi Pemanggilan Kejagung
Dan, Direktur Sekolah Dasar pada Direktorat Jenderal Pendidikan Anak Usia Dini, Pendidikan Dasar, dan Pendidikan Menengah pada tahun 2020-2021 sekaligus Kuasa Pengguna Anggaran (KPA) di Lingkungan Direktorat Sekolah Dasar Tahun Anggaran 2020-2021, Sri Wahyuningsih.
“Terhadap 4 orang tersebut, malam hari ini penyidik telah memiliki barang bukti yang cukup untuk menetapkan yang bersangkutan sebagai tersangka,” kata Qohar.
Qohar menjelaskan, keempat tersangka ini telah bersekongkol dan melakukan permufakatan jahat untuk melakukan pengadaan laptop berbasis Chromebook dalam program digitalisasi pendidikan di Kemendikbudristek tahun 2020-2022.
Penunjukkan sistem operasi Chrome ini dilakukan sebelum Nadiem Makarim resmi menjabat sebagai menteri.
Baca juga:Jurist Tan, Eks Stafsus Nadiem Akan Segera Ditetapkan sebagai Buronan
Para tersangka juga mengarahkan tim teknis kajian teknologi informasi dan komunikasi (TIK) untuk memilih vendor penyedia laptop yang.
Pengadaan bernilai Rp 9,3 triliun ini dilakukan untuk membeli laptop hingga 1,2 juta unit. Tapi, laptop ini justru tidak bisa dimanfaatkan secara optimal oleh para pelajar.
Pasalnya, untuk menggunakan laptop berbasis Chromebook ini perlu jaringan internet.
Diketahui, sinyal internet di Indonesia belum merata hingga ke pelosok dan daerah 3 T.
Ulah para tersangka juga menyebabkan kerugian keuangan negara hingga Rp 1,98 triliun.
Para tersangka disangkakan dengan Pasal 2 dan Pasal 3 ayat (1) jo. Pasal 18 Undang-Undang Nomor 31 Tahun 1999 sebagaimana diubah dan ditambah dengan Undang-Undang Nomor 20 Tahun 2001 tentang Perubahan atas Undang-Undang Nomor 31 Tahun 1999 tentang Pemberantasan Tindak Pidana Korupsi jo. Pasal 55 ayat (1) ke-1 KUHP.",Apa tanggapan dari Jaksa Agung Muda terhadap permohonan ekstradisi?,Sudah diajukan ekstradisi.
"KOMPAS.com- Menteri Dalam Negeri (Mendagri) Muhammad Tito Karnavian meminta pemerintah daerah (Pemda) untuk mempercepat penerbitan Persetujuan Bangunan Gedung (PBG) dan Bea Perolehan Hak atas Tanah dan Bangunan (BPHTB).
Percepatan itu diperlukan guna mendukung Program Strategis Nasional (PSN), yaitu 3 Juta Rumah bagi masyarakat berpenghasilan rendah (MBR).
""Kesepakatan dengan Menteri Perumahan dan Kawasan Permukiman (PKP), Menteri Pekerja Umum (PU), Mendagri untuk menolkan BPHTB. Itu biasanya 5 persen dari Nilai Jual Objek Pajak (NJOP), dan masuk dalam PAD (Pendapatan Asli Daerah). Kemudian membebaskan juga PBG, Persetujuan Bangunan Gedung, (yang) dahulu namanya Ijin Mendirikan Bangunan (IMB),” kata Mendagri dalam siaran persnya.
Hal tersebut disampaikan Mendagri saat memimpin Rapat Koordinasi (Rakor) Pengendalian Inflasi Daerah yang dirangkaikan dengan Pembahasan Evaluasi Dukungan Pemda dalamProgram 3 Juta Rumah.
Rakor digelar secara hybrid dari Gedung Sasana Bhakti Praja (SBP), Kantor Pusat Kementerian Dalam Negeri (Kemendagri), Jakarta, Selasa (22/7/2025).
Baca juga:Mendagri Dampingi Presiden Prabowo Luncurkan 80.000 Kopdeskel Merah Putih
Mendagri menjelaskan, Program 3 Juta Rumah per tahun yang digawangi Kementerian PKP menargetkan pembangunan maupun renovasi rumah di wilayah perkotaan dan perdesaan.
Untuk mendukung program itu, pemerintah telah menerbitkan sejumlah kebijakan, seperti pembebasan retribusi PBG dan BPHTB bagi MBR, serta percepatan proses perizinan bangunan.
Ia menambahkan, pemerintah telah menyediakan sistem pendataan daring yang terhubung ke dalam Sistem Informasi Pemerintahan Daerah (SIPD) untuk mencatat jumlah PBG dan BPHTB yang diterbitkan oleh masing-masing pemda.Sebelumnya, data tersebut direkap secara manual.
Hingga saat ini, total PBG yang telah terbit sebanyak 47.654, sementara untuk BPHTB sebanyak 244.722 unit. Pemda diminta aktif menginput data terbaru ke dalam SIPD ketika terjadi pembaruan.
Lebih lanjut, Mendagri menyampaikan bahwa Badan Pusat Statistik (BPS) nantinya akan memverifikasi apakah rumah-rumah tersebut telah direnovasi atau selesai dibangun sesuai dokumen penerbitan PBG.
Oleh karena itu, kepala daerah diimbau untuk aktif menyosialisasikan dan mendorong masyarakat serta pengembang agar memanfaatkan fasilitas pembebasan retribusi PBG dan BPHTB bagi MBR.
Baca juga:Mendagri Usul Kepala Daerah Dapat Insentif dari PAD, Sebut Bentuk Penghargaan Kerja Keras
“Teman-teman kepala daerah, jangan merasa kecil hati PAD-nya berkurang, masa kita mau narik dari orang yang tidak mampu,” imbuhnya.
Mendagri menegaskan bahwa isu perumahan menjadi program prioritas yang menjadi perhatian Presiden Prabowo Subianto. Karena itu, seluruh kepala daerah perlu memahami pentingnya pelaksanaan program ini.
Ia mengingatkan bahwa Program 3 Juta Rumah merupakan bagian dari PSN yang memiliki konsekuensi hukum. Pemerintah dapat memberikan sanksi berupa teguran hingga pencopotan kepala daerah yang tidak melaksanakannya sesuai ketentuan yang berlaku.
“Nah, kenapa ini penting diketahui? Karena program ini selain perlu dukungan dan harus didukung, dan itu kena risiko kalau tidak dilaksanakan sesuai Undang-Undang Nomor 23 [Tahun] 2014 tentang kewajiban, sanksi, dan larangan, maka PSN disebutkan secara eksplisit, tegas dalam undang-undang,” tandasnya.
Turut hadir secara langsung dalam Rakor tersebut Kepala BPS Amalia Adininggar Widyasanti, Direktur Jenderal (Dirjen) Perumahan Perdesaan Kementerian PKP Imran, Pelaksana Tugas (Plt.) Deputi II Bidang Perekonomian dan Pangan Kantor Staf Presiden (KSP) Edy Priyono, serta Direktur Pengawasan Penerapan Standar Keamanan dan Mutu Pangan Badan Pangan Nasional (Bapanas) Hermawan.",Apa tujuan Menteri Muhammad Tito Karnavian dalam melakukan pemberitahuan kepada Pemda?,Mempercepat penerbitkan Persetujuan Bangunan dan membebaskan BPHTB.
"JAKARTA, KOMPAS.com -Kejaksaan Agungmenduga para pejabat bank yang ditetapkan sebagai tersangka kasus dugaan korupsi pemberian kredit dari sejumlah bank daerah dan bank pemerintah kepada PT Sri Rejeki Isman TBK (Sritex) menerima sejumlah imbalan ataufeedbackaliasfee.
“Tapi, rangkaian proses penyidikan ini tentunya ada indikasifeedback(atau fee) kepada pejabat bank,” ujar Direktur Penyidikan Jaksa Agung Muda Tindak Pidana Khusus (Dirdik Jampidsus) Kejagung, Nurcahyo Jungkung Madyo saat konferensi pers di Gedung Bundar Jampidsus Kejagung, Jakarta, Senin (21/7/2025).
Namun, Nurcahyo mengatakan, angka imbalan yang diterima oleh pejabat bank ini masih dalam penyidikan.
Baca juga:Bos-bos Bank Daerah Jadi Tersangka karena Beri Kredit ke PT Sritex meski Tak Layak
“Jadi, di proses penyidikan hal tersebut masih kita dalami,” lanjut Nurcahyo.
Hari ini, Kejaksaan Agung mengumumkan delapan tersangka baru dalam kasus dugaan korupsi pemberian kredit kepada Sritex.
Mereka adalah Allan Moran Severino (AMS), Mantan Direktur Keuangan PT Sritex;
Babay Farid Wazadi (BFW), Direktur Bisnis Bank DKI 2012-2022;
Pramono Sigit (PS), selaku Direktur Teknologi dan Operasional Bank DKI 2015-2021;
Yuddy Renald (YR), Direktur Utama Bank BJB 2019-2025;
Supriyatno (SPRY), Direktur Utama Bank Jateng 2014-2023;
Pujiono (PJN), Direktur Bisnis Koperasi dan Komersial Bank Jateng tahun 2019;
Baca juga:Kejagung Duga Eks Direktur Sritex Cairkan Kredit pakai Invoice Fiktif
Benny Riswandi (BR), selaku Senior Executive VP Bank BJB 2019-2024, dan SD, selaku Kepala Divisi Bisnis Korporasi dan Komersial Bank Jateng 2018-2020.
Sementara, tiga tersangka yang lebih dahulu diumumkan adalah Komisaris Utama PT Sritex, Iwan Setiawan Lukminto (IS);
Dicky Syahbandinata (DS), selaku pemimpin Divisi Korporasi dan Komersial PT Bank Pembangunan Daerah Jawa Barat dan Banten tahun 2020;
dan Zainudin Mapa (ZM), selaku Direktur Utama PT Bank DKI Jakarta tahun 2020 sebagai tersangka bersama-sama dengan Iwan Setiawan.","Kejaksaan Agung menambah tersangka baru dalam kasus dugaan korupsi pemberian kredit ke Sritex, apakah hal tersebut merugikan negara?",Ya
"JAKARTA, KOMPAS.com -Sebanyak 339 warga negara Indonesia (WNI) terjaring dalam operasi pemberantasanonline scamalias penipuanonlineyang dilakukan pemerintahKambojasejak 14 Juli 2025.
Menteri Senior dan Kepala Sekretariat Committee to Combat Online Scams (CCOS) Kamboja, Chhay Sinarith, mengatakan bahwa operasi tersebut merupakan implementasi langsung dari perintah Perdana Menteri Hun Manet tanggal 14 Februari 2025 lalu.
""Dan menjadi bukti atas komitmen Pemerintah Kerajaan Kamboja dalam penanggulangan kejahatanpenipuan daring, yang telah menjadi isu prioritas bagi Kamboja dan kawasan,” ujar Senior Minister Chhay Sinarith dalam keterangan pers, Senin (21/7/2025).
Baca juga:Kisah Pahit Warga Jogja Tertipu Lowongan Kerja, Berujung Jadi Scammer di Kamboja
Dilansir dari keterangan pers Kementerian Luar Negeri RI (Kemenlu RI), total ada 2.780 orang yang terjaring operasi di 15 provinsi di Kamboja, 339 orang WNI di atas termasuk di dalamnya.
Sebagai tindak lanjut dari operasi ini, otoritas Kamboja akan melakukan proses penyelidikan terhadap para warga negara asing yang tertangkap dan mendalami kasus di setiap provinsi yang berbeda-beda.
Otoritas Kamboja akan memproses secara hukum pihak-pihak yang terlibat atas berbagai tindakan kejahatan yang terkait dengan penipuan daring, termasuk pencucian uang, penipuan lowongan pekerjaan, dan tindakan kekerasan.
Baca juga:Terjebak Tawaran Kerja di Medsos, Puspa Dijual ke Sindikat Penipu Online di Kamboja
Duta Besar Republik Indonesia untuk Kerajaan Kamboja Santo Darmosumarto menyampaikan dukungan bagi upaya penegakan hukum yang dilakukan Pemerintah Kamboja.
Menurut Santo, tindak kejahatan penipuan daring yang sifatnya transnasional memerlukan kerja sama erat di antara negara-negara yang terkait.
Untuk itu, dan sejalan dengan semangat 2023 ASEAN Leaders' Declaration on Combating Trafficking in Persons Caused by the Abuse of Technology, KBRI Phnom Penh siap untuk meningkatkan koordinasi dan komunikasi dengan instansi-instansi terkait di Kamboja dan Indonesia.
Baca juga:Operator Judol Jaringan China-Kamboja Bikin 500 Akun WhatsApp Per Hari Buat Cari Korban
Di sisi lain, Santo juga menegaskan pentingnya agar hak-hak dasar WNI yang terjaring operasi tetap terlindungi.
“Kami mendukung penuh upaya penegakan hukum Pemerintah Kamboja. Di saat yang sama, kami juga berkepentingan untuk memastikan bahwa para WNI yang saat ini berada dalam penanganan otoritas dapat diberikan hak-haknya, termasuk akses kekonsuleran dan informasi hukum yang jelas,” ujar Santo.",Mengapa ada operasi tersebut?,Operasi untuk mengantisipasi pemberantasan scam online.
"JAKARTA, KOMPAS.com- Komisi PemberantasanKorupsi(KPK) mengungkapkan, penyidik memeriksa anggota kepolisian sebagai saksi dalam kasus dugaankorupsiproyek jalandiSumatera Utara(Sumut).
Juru Bicara KPK Budi Prasetyo mengatakan, pemeriksaan terhadap anggota polisi itu dilakukan di Polda Sumut.
“KPK sudah melakukan pemeriksaan terhadap salah satu anggota kepolisian dan sudah dilakukan, berjalan dengan baik,” kata Budi dalam keterangannya, Rabu (23/7/2025).
Baca juga:KPK Dalami Pergeseran Anggaran 2 Proyek PUPR Saat Periksa Eks Pj Sekda Sumut
Budi mengatakan, KPK mengapresiasi pihak kepolisian atas dukungan sehingga proses pemeriksaan berjalan dengan lancar.
Meski demikian, KPK belum mengungkap identitas anggota polisi yang diperiksa.
Budi hanya mengatakan, anggota polisi itu didalami keterangannya terkait adanya aliran uang dalam proyek jalan tersebut.
“Tentu bagaimana proses pengadaannya, kemudian aliran uangnya ke pihak mana saja, itu semua ditelusuri oleh penyidik sehingga dalam perkembangannya tidak hanya terkait dengan proyek-proyek di Balai Besar PJN 1 Wilayah Sumut dan juga di PUPR Provinsi Sumatera Utara,” ujarnya.
Baca juga:KPK Periksa Eks Pj Sekda Sumut Jadi Saksi Kasus Proyek Jalan
Budi mengatakan, penyidik juga menemukan petunjuk terkait proyek yang dikerjakan oleh salah satu tersangka dalam kasus proyek jalan tersebut.
“Terkait dengan proyek yang dikerjakan oleh tersangka KIR di beberapa kabupaten/kota lainnya, itu kemudian yang penyidik terus lakukan penelusuran,” ujarnya.
Di sisi lain, Budi mengatakan, KPK juga menjadwalkan pemeriksaan terhadap Kajari Mandailing Natal, Muhammad Iqbal, dan Kasi Datun Kejari Mandailing Natal, Gomgoman Halomoan Simbolon.
Keduanya sedianya diperiksa sebagai saksi pada Jumat (18/7/2025) lalu. Namun, Budi mengatakan, pemeriksaan tersebut belum dilakukan karena KPK masih berkoordinasi dengan Kejaksaan Agung mengenai pemeriksaan tersebut.
Baca juga:KPK Cecar Istri Topan Ginting soal Temuan Uang Rp 2,8 M Dalam Kasus Proyek Jalan di Sumut
""KPK sudah berkirim surat, jadi kemarin sebelum dilakukan penjadwalan pada hari Jumat, penyidik sudah berkirim surat ke Kejaksaan Agung terkait dengan pemeriksaan kepada yang bersangkutan,"" ucap dia.
Sebelumnya, Kejaksaan Agung mempersilakan KPK untuk memeriksa anggotanya dalam kasus dugaan korupsi proyek pembangunan jalan di Sumatera Utara.
Kepala Pusat Penerangan Hukum (Kapuspenkum) Kejagung, Anang Supriatna, mengatakan, Kejaksaan tidak akan melindungi anggotanya jika mereka memang terbukti bersalah.
“Tidak mempermasalahkan (adanya pemanggilan). Kalau memang ibaratnya (salah), kita tidak akan melindungi. Kalau memang ada oknum dari kita, ibaratnya melanggar, ya proses,” ujar Kepala Pusat Penerangan Hukum (Kapuspenkum) Kejagung, Anang Supriatna, saat ditemui di Gedung Utama Kejagung, Jakarta, Selasa (22/7/2025).
Baca juga:KPK Periksa Istri Topan Ginting Terkait Kasus Proyek Jalan di Sumut
Anang mengatakan, KPK tentu perlu melakukan sejumlah mekanisme untuk menjalankan pemeriksaan ini.
Tapi, Anang menegaskan, selama ini, Kejaksaan dan KPK menjalin komunikasi yang baik dan rutin berkoordinasi.
“Kita sudah menjalin hubungan komunikasi dan koordinasi dengan baik dengan KPK. Ya tentunya, nanti kita bisa koordinasi kembali terkait pemanggilan yang bersangkutan,” kata Anang lagi.",Apakah KPK telah menyelesaikan identifikasi anggota kepolisian yang terlibat dalam pengaduan korupsi?,"Tidak, mereka belum mengungkap identitas."
"JAMBI, KOMPAS.com– Video rekaman keributan antara seorangdriverojekonline(ojol) wanita dan pelanggannya di Kota Jambi viral di media sosial. Peristiwa terjadi pada Minggu (20/7/2025) dan dipicu masalah pesanan makanan yang tak kunjung dibayar.
Driverbernama Rusdewi (40) akhirnya naik ke lantai dua rumah pelanggan karena merasa dirugikan. “Saya bilang, saya ini cuman cari makan, bayar tunai saja emangnya kenapa?” kata Rusdewi saat ditemui di kediamannya, Selasa (22/7/2025).
Kompas.commenelusuri insiden ini dan mendapatkan kronologi lengkap dari Rusdewi. Ia mengatakan bahwa saat itu menerima pesanan Ayam Bakar Rempah Madu atas nama konsumen bernama Alika Alihandra.
“Saya bawa dua pesanan makanan waktu itu. Saya dahulukan pesanan dia ini (Alika) karena dia yang pesan duluan,” ujar Rusdewi.
Baca juga:Mobilnya Oleng dan Terbalik, Mahasiswa di Medan Tabrak Driver Ojol
Setibanya di Perumahan Vila Kenali, Rusdewi menyerahkan makanan dan menunggu pembayaran via QR. Namun, notifikasi tidak juga masuk ke akun Grab miliknya.
“Saya bilang belum masuk. Saya lihat dia memang lagingetik-ngetikdi HP. Biasalah kan, saya pikir jaringan. Terus saya kasih lihat layar HP (akun Grab) saya, bilang belum ada masuk,” katanya.
Setelah beberapa lama menunggu tanpa hasil, Rusdewi meminta agar pembayaran dilakukan secara tunai. Namun, konsumen bersikeras bahwa pesanannya sudah dibayar oleh orang lain.
“Awalnya dia scan barcode di aplikasi saya, ternyata dia cumafotoin. Terus dia bilang ‘Yo tunggu, saya kirim ke WA orang ni, QR mbak ni’,” kata Rusdewi menirukan ucapan pelanggan.
Menurut Rusdewi, konsumen berdalih pembayaran akan dilakukan oleh ibunya. “Tapi dia bilang, ‘Tunggu bentar, ini mami saya, mamin’ katanya gitu. Tapi saya kan masih ditunggu konsumen lain, saya bilang, kalau bisa bayar pakai tunai aja, takut saya dikomplain,” ujarnya.
Baca juga:Tak Ikut Demo Ojol, Driver: Kalau Enggak Narik, Keluarga Enggak Makan
Rusdewi mengaku menunggu selama 30 menit, namun pembayaran tidak kunjung masuk. Ia pun memutuskan mengantar pesanan lain. “Karena kan, kalau mau antar orderan yang kedua, orderan yang pertama harus selesai. Akhirnya, saya antar orderan kedua, saya minta maaf karena telat,” katanya.
Setelah mengantar pesanan berikutnya, Rusdewi kembali ke rumah pelanggan. Ia sempat meminta bantuan seorang pria untuk memanggil konsumen, namun tidak mendapat respons.
Puncaknya, Rusdewi naik ke lantai dua rumah konsumen dan terjadi perkelahian fisik. Aksi itu terekam video dan viral setelah kedua belah pihak menyebarkan klarifikasi versi masing-masing.
Keributan berakhir setelah nenek dari konsumen membayar pesanan sebesar Rp 30 ribu secara tunai.
Kompas.comjuga sempat menyambangi rumah pelanggan, namun pihak keluarga menyatakan tidak bersedia diwawancarai. Mereka mengaku telah melapor ke Polresta Jambi.",Apa masalah yang terjadi di Kota Jambi pada Minggu (20/7/2025)?,Keributan video online dan kesulitan dalam memperolehkan makanan.
"JAKARTA, KOMPAS.com- Ketua Badan Pengkajian (BP) MPR RIAndreas Hugo Pareiramenyampaikan bahwa proses perumusanPokok-Pokok Haluan Negara(PPHN) telah memasuki fase strategis.
Hal tersebut, kata Andreas, ditandai dengan selesainya pembahasan terhadap 382 Daftar Inventarisasi Masalah (DIM) untuk PPHN oleh tim perumus BP MPR RI.
“Prinsipnya, tim perumus sudah menyelesaikan tugasnya. Setelah ini akan dilanjutkan dengan rapat pimpinan atau langsung rapat pleno untuk mengambil keputusan yang berkaitan dengan substansi maupunbentuk hukumdari PPHN,” kata Andreas, dalam siaran pers yang diterima Kompas.com, Selasa (22/7/2025).
Menurut Andreas, penyelesaian DIM tersebut menjadi pijakan penting dalam reformulasi arahpembangunan nasional.
Baca juga:Eks Marinir Satria Arta: Dulu Gabung Jadi Tentara Bayaran Rusia, Kini Minta Pulang
Salah satu isu sentral dalam pembahasan adalah bentuk hukum dari PPHN.
Sebab, lanjut Andreas, bentuk hukum yang tepat akan menjadi kunci bagi efektivitas implementasi haluan negara oleh lembaga eksekutif maupun lembaga negara lainnya.
“Bentuk hukumitu ibarat pintu masuk. Jika tidak jelas atau tidak tepat bentuknya, akan sulit bagi PPHN untuk dijalankan secara efektif oleh eksekutif maupun lembaga negara lainnya,” ujar dia.
Selain aspek legalitas, politikus PDI-P itu menegaskan bahwa substansi dan arah kebijakan jangka panjang di PPHN juga menjadi fokus utama dalam pembahasan.
Andreas mengingatkan pentingnya haluan negara yang mencerminkan kondisi umum bangsa, serta mampu memberikan arah yang sistematis dan realistis bagi pemerintahan, dalam menyusun prioritas pembangunan nasional.
“Arah kebijakan yang tertuang dalam PPHN akan menentukan bagaimana Presiden melihat haluan negara ini, apakah dianggap mengambil kewenangan atau justru menjadi solusi bersama untuk memastikan kesinambungan pembangunan nasional,” kata Andreas.
Andreas menerangkan bahwa perumusan PPHN bukan upaya menciptakan haluan baru, melainkan refleksi kritis terhadap kondisi objektif bangsa.
Baca juga:Keakraban Prabowo-Jokowi di Solo, Tepis Isu Pecah Kongsi?
Dalam proses ini, Andreas berharap seluruh pihak untuk terbuka terhadap kenyataan dan melakukan otokritik atas berbagai kekurangan dalam sistem pembangunan yang ada.
“PPHN bukan sekadar dokumen teknokratis. Ini adalah refleksi dari pengalaman kita sebagai bangsa: apa yang berhasil, apa yang gagal, dan apa yang perlu diperbaiki. Kita tidak bisa hanya mengandalkan semangat, tapi harus punya peta jalan yang terukur dan rasional jika ingin mencapai Indonesia Emas 2045,” ujar Andreas.
Andreas menambahkan bahwa sejumlah tantangan nyata telah dicatat dalam bagian kondisi umum PPHN.
Beberapa di antaranya adalah ketimpangan pembangunan antarwilayah, stagnasi sektor strategis, hingga dampak globalisasi terhadap kedaulatan ekonomi nasional.
Dia pun menegaskan bahwa PPHN tidak boleh dipahami sebagai bentuk intervensi MPR terhadap lembaga eksekutif, tetapi sebagai landasan kolektif untuk menjamin kesinambungan pembangunan antarperiode pemerintahan.
Baca juga:Kecaman Prabowo ke Vampir Ekonomi, Serakahnomics hingga Penggiling Brengsek
“PPHN adalah arah yang kita rumuskan bersama. Ini bukan milik satu institusi saja. Ini adalah hasil dari berbagai masukan, pemikiran, dan evaluasi yang disampaikan oleh banyak pihak, dan harus menjadi milik bangsa. Tanpa arah yang jelas, pembangunan kita berisiko terputus-putus setiap kali terjadi pergantian pemimpin,” tutur Andreas.
Dia pun berharap PPHN dapat segera difinalisasi dalam bentuk hukum yang tepat dan disepakati bersama dalam rapat pleno.
Dia mengajak seluruh komponen bangsa untuk memandang PPHN sebagai instrumen pemersatu dan pengarah pembangunan nasional yang inklusif, berkelanjutan, dan berkeadilan.",Apakah Andreas menyarankan bahwa proses perumusan PPHN telah masuk fase strategis dan dilanjutkan dengan rapat pimpinan?,"Ya, Andrea mengatau ini."
"JAKARTA, KOMPAS.com-Kejaksaan Agungmenerima pengalihan pengelolaan Rumah Penyimpanan Benda Sitaan Negara (Rupbasan) dari Kementerian Imigrasi dan Pemasyarakatan (Kemen Imipas).
Ada 59 Rupbasan di seluruh Indonesia yang diserahkan Kemen Imipas pada Kejaksaan RI.
“Pada kesempatan yang baik ini telah secara resmi dilakukan serah terima pengalihanpengelolaan Rupbasandari Kemen Imipas kepada Kejaksaan RI,” ujar Menteri Imipas Agus Andrianto saat memberikan sambutan di Gedung Utama Kejaksaan Agung, Jakarta, Selasa (22/7/2025).
Baca juga:KPK Kirim 11 Mobil dan 2 Motor Hasil Sitaan Kasus Kemenaker ke Rupbasan
Agus berharap, peralihan pengelolaan Rupbasan kepada Kejaksaan membuat prosespenegakan hukummenjadi lebih efisien dan akuntabel.
Terutama, dalam hal penyitaan dan barang rampasan negara hasil tindak pidana kejahatan.
“Dengan pengelolaan Rupbasan (kini ditangani) Kejaksaan RI diharapkan agar tercipta efektivitas yang lebih tinggi dalam proses eksekusi benda sitaan dan barang rampasan negara,” lanjut Agus.
Pengelolaan Rupbasanoleh Kejaksaan RI juga dinilai relevan dengan upaya pemerintah untuk mengoptimalkan pemulihan aset negara yang menjadi amanat Reformasi.
Baca juga:Motor Royal Enfield Milik Ridwan Kamil Sudah Dipindah ke Rupbasan KPK
“Kami meyakini bahwa rangka ini bukan sekadar kewenangan administrasi melainkan bagian dari strategi besar pemerintah untuk memperkuat sistem peradilan negara nasional,” kata Agus lagi.
Kerja sama antar lembaga ini disambut baik oleh Jaksa Agung ST Burhanuddin.
Ia memastikan, proses lelang maupun penyitaan barang tetap berjalan seperti biasa.
“Kalau memang ada barang-barang yang dilelang atau harus memenuhi proses-proses apa yang dilakukan, kita akan dalami. Tidak ada perbedaan pelaksanaan tapi pengelolaan saja,” kata Burhanuddin.
Baca juga:KPK Akui Ada Kendala untuk Pindahkan Motor Ridwan Kamil ke Rupbasan
Ia mengatakan, pengalihan pengelolaan Rupbasan ini merupakan sinergi antar lembaga untuk membuat proses penegakan hukum menjadi lebih efektif.
Lebih lanjut, Burhanuddin juga menyoroti 709 pegawai Kemen Imipas yang memilih untuk ikut pindah ke Kejaksaan RI.
Para pegawai ini tetap ditugaskan di Rupbasan, sesuai penugasan mereka selama ini.
“Bergabungnya pegawai Rupbasan yang ke dalam lingkungan Kejaksaan RI bukan hanya penyesuaian administratif semata, namun merupakan bagian dari transformasi kelembagaan yang lebih besar,” katanya.",Kejaksaan Agungmenerima apakah transfer dari Kementerian Imigrasi ke pengelolaan Rupbasan?,"Ya, resmi dilaksanakan."
