content,question,answer
"JAKARTA, KOMPAS.com -Wakil Ketua Komisi X DPR RILalu Hadrian Irfanimendorong pemerintah segera merancangkurikulum nasionalyang berfokus pada pencegahankekerasan seksualdi lingkungan pendidikan, termasuk sekolah dan pesantren.
Menurut Lalu, Indonesia sudah sepatutnya memiliki kurikulum khusus yang menyasar pencegahan pelecehan dan pencabulan di satuan pendidikan, baik formal maupun berbasis keagamaan seperti pesantren.
""Kurikulum ini harus dirancang lintas disiplin, menginspirasi rasa hormat terhadap tubuh, mengajarkan batasan, mengenalkan hak-hak anak, serta membangun keberanian untuk berkata 'tidak' terhadap pelecehan,"" ujar Lalu Hadrian, Selasa (22/7/2025).
Baca juga:Kasus Pelecehan Oknum Pembina Pramuka di Samarinda, Empat Korban Jalani Pemeriksaan Polisi
Politikus Partai Kebangkitan Bangsa itu mengungkapkan bahwa sekolah dan pesantren sejatinya adalah ruang untuk membentuk karakter anak bangsa.
Namun, fakta di lapangan juga menunjukkan bahwa lembaga pendidikan menjadi tempat terjadinya banyak kasus pelecehan.
""Tempat yang seharusnya menjadi rumah kedua bagi anak-anak kini berubah menjadi arena teror, tempat di mana kepercayaan dilukai dan harapan dikhianati,"" ucap Lalu.
Baca juga:Pelaku Pelecehan Seksual Anak di Bawah Umur Penumpang Citilink Jadi Tersangka
Dia pun mengutip data Jaringan Pemantau Pendidikan Indonesia (JPPI) yang mencatat 573 kasus kekerasan di lingkungan pendidikan sepanjang 2024, 42 persen di antaranya adalah kasus pencabulan.
""Ironisnya, 36 persen kasus bahkan terjadi di lembaga pendidikan berbasis agama, termasuk pesantren dan madrasah,"" kata Lalu.
Lalu menambahkan, tidak sedikit korbannya adalah anak-anak usia sekolah dasar (SD) dan sekolah menengah pertama (SMP).
Baca juga:Pelaksanaan Belum Merata, Dirjen Kemenag Pastikan Kawal MBG di Pesantren
Bahkan, pelaku kerap kali adalah sosok yang dipercaya membimbing para siswa, misalnya guru, ustaz, atau pengasuh pondok pesantren.
""Ini bukan lagi soal moral individu. Ini soal sistem. Maka, negara harus hadir dengan langkah struktural,"" kata dia.
Oleh karena itu, Lalu menilai sudah saatnya negara tidak hanya fokus pada sanksi dan penindakan, tetapi juga melakukan pencegahan sistemik melalui kurikulum nasional yang menyentuh akar persoalan.
Dia pun mengusulkan empat langkah strategis yang bisa dimulai oleh pemerintah bersama DPR RI.
Baca juga:Ada 25 Kasus Pelecehan di KRL Jabodetabek Januari-Juni 2025
“Pertama, dengan penyusunan kurikulum yang berbasis pencegahan pencabulan di sekolah dan pesantren berbasis budaya lokal dan nilai agama yang rahmatan lil'alamin,” kata Lalu.
""Kedua, pelatihan guru, pembina pesantren, dan seluruh tenaga kependidikan untuk memahami etika relasi kekuasaan dan sensitivitas perlindungan anak,"" sambungnya.
Ketiga, menyediakan mekanisme pelaporan yang aman dan berpihak pada korban, termasuk di pesantren yang selama ini cenderung tertutup dari pengawasan eksternal.
Baca juga:Kok Bisa Tokoh Agama Jadi Pelaku Pelecehan Seksual?
Keempat, memodelkan sekolah dan pesantren percontohan sebagai zona aman (Safe School and Pesantren Zone) untuk menunjukkan efektivitas pendekatan preventif.
""Saya percaya, bangsa ini masih memiliki nurani. Tapi nurani itu harus diperkuat oleh kebijakan yang berpihak dan regulasi yang tegas. Kita tidak bisa lagi menormalisasi kekerasan atas nama pendidikan,"" kata Lalu.
""Kita tidak bisa diam saat tubuh dan jiwa anak-anak kita dihancurkan oleh mereka yang sejatinya harus menjadi pelindung. Pendidikan yang baik bukan hanya mengajarkan prestasi, tetapi juga melindungi martabat,” ujar dia.",Apakah Wakil Ketua Komisi X Lalu Hadrian menyarankan untuk membuat kurikulum nasional yang mengatur pencegahan pelecehan seksual? Jawaban: Ya,Ya
"JAKARTA, KOMPAS.com- Guru besar Universitas Indonesia (UI), filsuf Franz Magnis Suseno atau Romo Magnis, hingga Jaksa Agung 1999-2001Marzuki Darusman, mengirimkan pandangan hukum sebagaiamicus curiaeatau ""sahabat pengadilan"" untuk perkara Sekretaris Jenderal PDI-P,Hasto Kristiyanto.
""Perkenankan kamiAliansi Akademik Independenturut memberikan pandangan akademik kami dalam perspektifsocio-legal, yaitu melihat hukum dalam konteks, dan bertujuan mendukung prinsipdue process of law, serta supremasi hukum dalam proses peradilan pidana,"" sebagaimana dikutip dari dokumenamicus curiaetersebut, Selasa (22/7/2025).
Baca juga:Kasus Hasto, 3 Praktisi Hukum Surabaya Kirim Dokumen Amicus Curiae ke Majelis Hakim
Kelompok ini bernama Aliansi Akademik Independen, dikoordinir Guru Besar Universitas Indonesia (UI) Suliatyowati Irianto. Adapun Romo Magnis hingga Marzuki tergabung dalam kelompok ini bersama nama-nama lainnya.
Kelompok ini terdiri dari 23 akademisi dan aktivis dari berbagai universitas.
Kompas.comtelah mendapatkan konfirmasi kebenaran dokumen tersebut dari Sulistyowati Irianto.
KOMPAS.com/Fika Nurul UlyaKetua Misi Pencari Fakta Independen tentang Myanmar sejak 2017 sekaligus mantan Jaksa Agung Marzuki Darusman usai melakukan audiensi dengan komisioner Komnas HAM di Kantor Komnas HAM, Jakarta Pusat, Senin (23/10/2023).
Melaluiamicus curiaeitu, Romo Magnis dan kawan-kawan memandang penuntutan terhadap Hasto janggal dan menimbulkan kekhawatiran besar bahwa independensi peradilan dan demokrasi melemah.
Para akademisi ini menyoroti bukti yang dihadirkan oleh jaksa Komisi Pemberantasan Korupsi (KPK) di persidangan yang lemah, prosedur pemeriksaan yang diwarnai pemaksaan, hingga momentum dimulainya penyelidikan yang terkesan lebih didorong oleh motivasi politik, alih-alih hukum.
Baca juga:Pakar Hukum: Kasus Tom Lembong dan Hasto adalah Persidangan dengan Motif Politik
Tindakan semacam ini kerap terjadi di negara dengan sistem demokrasi lemah atau di bawah kepemimpinan otoriter.
Adapun kasus hukum Hasto, menurut mereka, tidak bisa terlepas dari sikap kritisnya kepada pemerintahan Presiden Ke-7 RI, Joko Widodo (Jokowi).
""Dalam kasus Hasto Kristiyanto, penuntutan terhadap fungsionaris partai politik yang sangat kritis kepada pemerintahan Jokowi ini tampaknya didasarkan pada motif politik,"" ujar Romo Magnis dan kawan-kawan.
KOMPAS.com/NICHOLAS RYAN ADITYAGuru Besar Filsafat STF Driyarkara, Franz Magnis Suseno atau Romo Magnis dalam jumpa pers mengenai RUU TNI di STF Driyarkara, Jakarta, Selasa (18/3/2025).
Baca juga:Pembelaan Terakhir Hasto sebelum Menghadapi Vonis Hakim
Berikut adalah 23 nama akademisi dan aktivis ""Aliansi Akademik Independen"" yang mengajukan amicus curiae untuk Hasto Kristiyanto:
1. Prof. Franz Magnis Suseno dari Sekolah Tinggi Filsafat (STF) Driyarkara
2. Prof. Maria W. Soemardiono dari Universitas Gadjah Mada (UGM)
3. Mayling Oey-Gardiner dari UI
4. Prof. Riris Sarumpaet dari UI",Apakah Aliansi Akademik Independent adalah kelompok yang terlibat dalam pemberitahuan amicus curiae?,"Ya, ini sesuai dengan artikel."
"JAKARTA, KOMPAS.com- Revisi Kitab Undang-Undang Hukum Acara Pidana (KUHAP) diminta mengatur batas waktu maksimal untukpenyelidikandanpenyidikan.
“Yang pertama adalah tahap penyelidikan sebagaimana Pasal 5 KUHAP,"" kata Ketua Masyarakat Hukum Pidana dan Kriminologi Indonesia (Mahupiki)Firman Wijayadalam rapat dengar pendapat umum (RDPU) bersama Komisi III DPR RI terkait RUU KUHAP, Selasa (22/7/2025).
""Dalam batas waktu ini, memang kami berharap ada ketetapan waktu yang jelas, yaitu enam bulan atas fase penyelidikan maupun tindakan penyelidikan,” imbuhnya.
Baca juga:Revisi KUHAP Atur TNI Jadi Penyidik Tindak Pidana Umum, Dinilai Hidupkan Dwifungsi ABRI
Dalam kesempatan itu, Firman turut menyoroti Pasal 59E dalam RUU KUHAP yang masih perlu ditinjau ulang. Salah satu terkait perlunya perpanjangan waktu penyidikan menjadi 60 hari.
Sebab, dalam pelaksanaannya kerap terjadi perbedaan pendapat antara penyidik dan jaksa penuntut umum dalam gelar perkara.
“Dalam keadaan penyidik berkesimpulan bahwa penyidikan telah cukup bukti, sedangkan penuntut umum berpendapat bahwa penyidikan belum maksimal, artinya tidak ada kesepakatan,” ungkap Firman.
Baca juga:Sebut RUU KUHAP Sangat Urgent, Juniver Girsang: Masyarakat Diuntungkan, Tak Lagi Mudah Ditekan
“Dalam gelar perkara, jangka waktu penyidikan atau pemeriksaan tambahan oleh Jaksa diberikan waktu 60 hari disesuaikan dengan penahanan dan perpanjangan penahanan,” sambungnya.
Menurut dia, waktu 14 hari yang saat ini diatur dalam Pasal 59E ayat (6) terlalu singkat, jika dibandingkan dengan kebutuhan proses hukum serta waktu penahanan dan perpanjangannya.
Dia pun mengusulkan agar Pasal 59E ditambah dengan ayat (7) yang dapat mengakomodasi ketidaksepakatan tersebut, dengan tetap menjaga keseimbangan kewenangan antar-aparat penegak hukum.
“Perlu tambahan Pasal 59E ayat 7 karena kalau hanya 14 hari, sebagaimana diatur Pasal 59E ayat 6, rasanya tidak mungkin dapat teroperasionalkan dengan optimal, karena tidak ada keseimbangan ruang check and balance sistem penegakan,” jelas Firman.
Lebih lanjut, Mahupiki juga mendorong adanya pengaturan yang tegas terhadap pihak termohon dalam praperadilan yang sengaja menunda-nunda kehadiran.
“Apabila tidak terpenuhinya hak-hak yang diatur dalam acara pidana, itu juga dapat diuji dalam praperadilan. Dan bagi termohon, di mana pun dalam proses praperadilan, jika ada kesengajaan menunda-nunda memenuhi panggilan sidang, menurut saran kami, permohonan dapat dianggap melepaskan haknya untuk membuktikan, serta proses hukumnya tidak sesuai hukum acara. Otomatis termohon dianggap menyetujui putusan hakim praperadilan,” pungkas Firman.",Apa tujuan dari revisi KUHAP?,Memperbaharui batas waktu penyelidikan dan menuntaskan.
"JAKARTA, KOMPAS.com- PresidenPrabowo Subiantotampak menunjukkan kedekatannya dengan Presiden ke-7 RIJoko Widodosaat melakukankunjungan kerjadi Solo dan Klaten, pada Minggu (20/7/2025) dan Senin (21/7/2025).
Keakraban itu terlihat dalam sejumlah momen yang dilalui bersama, mulai dari silaturahmi ke kediaman Jokowi hingga makan bakmi Jawa di salah satu rumah makan.
Keduanya terlihat sangat akrab dengan mengobrol dan tertawa bersama.
Mampir dan bersilaturahmi ke kediaman Jokowi menjadi hal utama yang dilakukan Prabowo saat tiba di Solo, Jawa Tengah.
Baca juga:Kecaman Prabowo ke Vampir Ekonomi, Serakahnomics hingga Penggiling Brengsek
Prabowo saat itu didampingi oleh Wakil Presiden Gibran Rakabuming Raka dan Sekretaris Kabinet (Seskab) Teddy Indra Wijaya.
Kedatangan Prabowo segera disambut oleh Jokowi dan istrinya, Iriana Jokowi.
Prabowo ketika itu menyampaikan bahwa dirinya baru sempat mampir setelah dua minggu berada di luar negeri untuk kunjungan kerja.
""Apa kabar, Pak?"" ujar Prabowo, sembari berjalan mendekati Jokowi dan Iriana.
""Baru sempat mampir, Pak. Baru keliling, Pak, dua minggu,"" sambung Prabowo.
Jokowi lantas merespons dengan memberi sinyal kagum kepada Prabowo.
""Saya yang lihat saja sudah, inipower-nya dari mana ini,"" ujar Jokowi.
Keduanya lalu bertemu selama satu jam lamanya.
Usai bertemu, Prabowo mengungkapkan bahwa lawatan ini berisi banyak pembicaraan rahasia.
Baca juga:Menanti Aksi Aparat Usut Beras Oplosan Usai Prabowo Beri Perintah...
Namun, salah satunya membahas hasil lawatan ke luar negeri selama dua minggu.
Di kesempatan yang sama, Jokowi mengapresiasi sejumlah ""oleh-oleh"" yang dibawa Prabowo untuk Indonesia.
Dua di antaranya adalah bidang ekonomi, yakni kesepakatan penurunan tarif impor dengan Presiden AS Donald Trump dari 32 persen menjadi 19 persen, dan perjanjian dagang IEU-CEPA yang berhasil mencapai kesepakatan politik setelah 10 tahun mandek.
""Saya rasa dua hal besar itu yang harus kita berikan apresiasi, acungi jempol, dan semuanya diselesaikan langsung oleh Bapak Presiden Prabowo, sangat bagus,"" kata Jokowi, di tempat yang sama.",Apa kabar dari kunjungan Jokowi ke Solo dan Klaten?,Kunjungan tersebut menunjukkan persatuannya dengan Prabowo.
"JAKARTA, KOMPAS.com- Komisi Pemberantasan Korupsi (KPK) akan berkoordinasi denganKejaksaan Agung(Kejagung) terkait penanganan kasus yang menjerat eks Direktur UtamaBank BJBYuddy Renaldi.
Yuddy Renaldi baru ditetapkan sebagai tersangka oleh Kejagung terkait dengan kasus korupsi kredit sejumlah bank untuk PT Sritex.
“Tentunya akan dilakukan koordinasi, agar proses hukum keduanya tetap dapat berjalan dengan baik,” kata Juru Bicara KPK Budi Prasetyo saat dihubungi wartawan, Selasa (22/7/2025).
Baca juga:Eks Dirut BJB Yuddy Renaldi Jadi Tahanan Kota Usai Jadi Tersangka Kasus Korupsi Sritex
Dalam perkara Yuddy Renaldi di KPK, Budi mengatakan, saat ini masih terus dilakukan pemeriksaan saksi untuk melengkapi berkas perkara.
“Seperti apa konstruksi lengkap perkaranya, pihak-pihak yang ditetapkan tersangka dan penahanannya, kami akan update perkembangannya,” ujarnya.
Sebelumnya, KPK telah menetapkan lima orang tersangka dalam kasus korupsi pengadaan iklan di Bank BJB, yakni Direktur Utama Bank BJB Yuddy Renaldi dan Pejabat Pembuat Komitmen sekaligus Kepala Divisi Corsec BJB Widi Hartoto.
Baca juga:KPK Panggil Kepala Divisi Hukum Bank BJB Terkait Kasus Pengadaan Iklan
Kemudian, pengendali agensi Antedja Muliatama dan Cakrawala Kreasi Mandiri Ikin Asikin Dulmanan, pengendali agensi BSC Advertising dan Wahana Semesta Bandung Ekspress Suhendrik, serta pengendali Cipta Karya Sukses Bersama Sophan Jaya Kusuma.
Adapun penyidik KPK memperkirakan kerugian negara akibat dugaan korupsi di Bank BJB tersebut mencapai Rp 222 miliar.",Apa tindakan KPK terhadap kasus korupsi yuddy Renaldi?,"Menetapkan lima orang, jadi tersangka."
"JAKARTA, KOMPAS.com- PresidenPrabowo Subiantomengucapkan terima kasih kepada para orangtua wali yang sudah merelakan putra-putrinya untuk menjadi Perwira TNI/Polri.
Sebab, mereka akan mengabdi sebagai prajurit yang mendahulukan kepentingan bangsa dan negara.
Pelantikannya dilakukan langsung oleh Prabowo di Istana Merdeka, Kompleks Istana Kepresidenan, Jakarta Pusat, Rabu (23/7/2025).
""Saya ucapkan terima kasih kepada para orangtua yang telah merelakan putranya dan putrinya untuk mengabdi sebagai prajurit, sebagai perwira,"" kata Prabowo, Rabu.
Baca juga:Pesan Prabowo ke 2.000 Perwira TNI/Polri yang Baru Dilantik: Jadilah Polisi-Tentara Pembela Rakyat
Kepala Negara mengatakan, profesi perwira dan prajurit adalah profesi mulia. Namun, pekerjaannya tidak ringan.
Perwira harus selalu di depan, selalu memberikan contoh baik kepada masyarakat.
""Memberi contoh dengan gagah, dengan berani, dengan cerdas. Saudara harapan seluruh rakyat, berbaktilah dengan sebaik-baiknya,"" ucap Prabowo.
Mantan Menteri Pertahanan (Menhan) itu juga mengucapkan terima kasih kepada para pembina dan pelatih perwira yang dilantik hari ini.
Para pembina telah menggembleng patriot-patriot muda.
Oleh karenanya, Prabowo berharap perwira dapat memberikan dharma bakti kepada rakyat.
""Selamat bertugas perwira remaja TNI/Polri 2025. Rakyat negara dan bangsa menanti dharma baktimu,"" ujar Prabowo.
Baca juga:Prabowo Sematkan Penghargaan kepada 8 Peraih Adhi Makayasa saat Melantik Capaja
Sebagai informasi, perwira remaja yang dilantik merupakan taruna dan taruni tingkat akhir dari empat akademi, yakni Akademi Militer (Akmil), Akademi Angkatan Laut (AAL), Akademi Angkatan Udara (AAU), dan Akademi Kepolisian (Akpol).
Mereka terdiri dari 827 orang dari Akademi Militer (Akmil), 433 orang dari Akademi Angkatan Laut (AAL), 293 orang dari Akademi Angkatan Udara (AAU), dan 447 orang dari Akademi Kepolisian (Akpol).
Sebelum dilantik, para Capaja telah lebih dulu mendapat pembekalan dari Panglima TNI Agus Subiyanto di Gedung Olahraga (GOR) A Yani, Mabes TNI, Cilangkap, Jakarta Timur, Jumat (18/7/2025).
Baca juga:Eks Marinir Gabung Militer Rusia Minta Dipulangkan: Loyalitas dan Kewarganegaraannya Dipertanyakan
Agus meminta Capaja menjadiagen perubahandi satuan masing-masing dan garda terdepan dalam menjaga nilai-nilai Pancasila.
Pembekalan ini merupakan bagian dari rangkaian menuju Upacara Prasetya Perwira (Praspa) pada 23 Juli 2025, sebuah tonggak awal pengabdian para Capaja sebagai perwira pertama di lingkungan TNI dan Polri.",Apa tujuan utama dari perwira Prabu Subianto?,Mengabdi sebagai prajurit yang mendahului kepentingan bangsa.
"JAKARTA, KOMPAS.com- Anggota Komisi IX DPR RINetty Prasetiyani Ahermengaku prihatin terkait temuan 15 produk obat bahan alam (OBA) yang diketahui mengandungbahan kimiaobat (BKO) berbahaya.
Salah satunya adalah sildenafil sitrat.
Netty mengatakan, temuan ini sangat mengkhawatirkan karena dapat membahayakan keselamatan masyarakat sebagai konsumen.
Baca juga:BPOM Rilis Daftar 15 Obat Herbal dan Suplemen dari Negara Lain yang Mengandung BKO
""Temuan ini sangat memprihatinkan.Obat herbalseharusnya menjadi alternatif yang aman bagi masyarakat, bukan malah menjadi ancaman karena disusupi bahan kimia obat tanpa izin,"" kata Netty, dalam keterangannya, Selasa (22/7/2025).
Netty menekankan pentingnya pengawasan ketatBPOMyang mencakup seluruh rantai produksi, mulai dari produsen, pemasok bahan baku, hingga distribusi.
""BPOM tidak boleh hanya reaktif karena adanya kasus. Pengawasan proaktif dan inspeksi berkala harus ditingkatkan,"" kata Netty.
Legislator dari Dapil Jawa Barat VIII itu menuturkan, masyarakat juga perlu diberi literasi agar lebih cermat sebelum membeli produk herbal.
Baca juga:BPOM Ungkap 61 Obat Herbal yang Mengandung Bahan Kimia, Bisa Picu Kerusakan Hati
Pasalnya, penggunaan bahan kimia seperti sildenafil tanpa pengawasan dokter bisa menimbulkan dampak serius bagi kesehatan masyarakat.
""Jika disalahgunakan dalam produk herbal tanpa izin, ini jelas pelanggaran hukum dan etika kesehatan,"" ujarnya.
Netty mendukung langkah tegas BPOM yang telah menarik serta memusnahkan produk-produk berbahaya tersebut dari pasaran.
""Kesehatan publik tidak boleh dikorbankan karena ambisi bisnis. Saya mendorong BPOM, Kementerian Kesehatan, dan stakeholder terkait untuk membuat sistem yang tidak memberi celah bagi pelaku usaha yang curang,"" papar Netty.
Baca juga:BPOM Ungkap Daftar Obat Herbal Produksi Klaten dan Kudus yang Bisa Merusak Hati dan Jantung
Seperti diketahui, BPOM menarik 15 produk obat tradisional ilegal yang ditemukan mengandung zat kimia keras yang seharusnya hanya bisa dikonsumsi dengan resep dokter sepanjang Juni 2025.
Dalam uji laboratorium, sederet obat tradisional yang ternyata dioplos dengan bahan kimia keras beredar luas, terutama secara online.
Selain sildenafil, BPOM juga menemukan kandungan lain seperti deksametason, parasetamol, klorfeniramin maleat, hingga sibutramin HCl.
Semua zat tersebut termasuk obat keras yang tidak boleh dikonsumsi tanpa pengawasan tenaga medis.",Apakah Netty menyarankan pentingnya opsi apa dalam pengawasannya?,Pengawasian proaktif dan inspeksi berkala harus ditingkatkan.
"JAKARTA, KOMPAS.com -Mantan Menko PolhukamMahfud MDmenilai, vonis 4,5 tahun penjara yang dijatuhkan hakim Pengadilan Tindak Pidana Korupsi Jakarta terhadap mantan Menteri Perdagangan Thomas Trikasih Lembong aliasTom Lembongadalah salah.
""Setelah saya mengikuti isi persidangan dan mendengar vonisnya, maka menurut saya vonis itu salah,"" kata Mahfud kepadaKompas.com, Selasa (22/7/2025).
Mahfud mengakui, awalnya ia menilai penetapan Tom Lembong sebagai tersangka kasus dugaan korupsi terkait impor gula sudah sesuai dengan aturan hukum.
Baca juga:Tom Lembong Resmi Ajukan Banding
Ketika itu, Mahfud menjelaskan bahwa seseorang dapat dijerat sebagai tersangkakasus korupsiapabila memperkaya diri sendiri atau orang lain, atau korporasi dengan cara melawan hukum dan merugikan keuangan negara.
""Jadi, meskipun Tom Lembong tidak menerima dana tersebut, tapi jika memperkaya orang lain atau korporasi, maka bisa disangka korupsi jika ditambah unsur melawan hukum dan merugikan keuangan negara,"" kata dia.
Namun, setelah mengikuti proses persidangan, ia menilai hakim telah melakukan kesalahan dengan menjatuhkan hukuman pidana terhadap Tom Lembong.
Baca juga:Vonis 4,5 Tahun Tom Lembong: Terbaliknya Efek Jera
Alasannya, menurut Mahfud, jalannya persidangan tidak menemukan niat jahat ataumens readalam perbuatan Tom Lembong.
""Untuk menghukum seseorang, selainactus reus(perbuatan pidana), masih harus adamens reaatau niat jahat. Dalam konteksvonis Tom Lembongini, ternyata tidak ditemukan mens rea atau niat jahat,"" kata Mahfud.
Mantan ketua Mahkamah Konstitusi ini juga menyinggung kebijakan impor gula yang dilakukan oleh Tom Lembong itu dilakukan atas perintah.
Baca juga:Ekonomi Kapitalis Jadi Alasan Hakim Vonis Tom Lembong, Feri Amsari Heran
Dengan demikian, kebijakan yang dilakukan Tom Lembong itu berasal dari hulu yang mengalir kepadanya, untuk diteruskan lagi sampai ke hilir.
""Menurut saya, tidak ada unsurmens reasehingga tidak bisa dipidanakan. Dalilnya 'geen straf zonder schuld', artinya 'tidak ada pemidanaan jika tidak ada kesalahan'. Unsur utama kesalahan itu adalah mens rea. Nah, dikasus Tom Lembongtidak ditemukan mens rea karena dia hanya melaksanakan tugas dari atas yang bersifat administratif,"" kata Mahfud.
Baca juga:Ramai-ramai Soroti Vonis Tom Lembong: Ekonomi Kapitalis, Tak Ada Mens Rea
Mahfud menambahkan, vonis Tom Lembong juga mempunyai sejumlah kelemahan, misalnya tidak menunjukkan rangkaian logis tentangactus reusatau perbuatan pidana yang dilakukan Tom Lembong.
Pakar hukum tata negara ini juga menilai vonis tersebut lemah karena hakim membuat hitungan kerugian negaranya dengan cara sendiri, bukan merujuk pada perhitungan resmi yang dibuat oleh BPKP.
""Hakim juga bercanda lucu bahwa salah satu yang memberatkan Tom Lembong adalah membuat kebijakan yang kapitalistik. Tampaknya hakim tak paham bedanya ide dan norma,"" ujar Mahfud.
Oleh sebab itu, Mahfud pun mendorong Tom Lembong untuk berani meminta Pengadilan Tinggi dalam mengoreksivonis hakimmelalui banding.
Baca juga:PN Jakpus Sebut Hakim Kasus Tom Lembong Bebas dari Tekanan dan Intervensi Politik",Apakah Tom Lembong menilai penetapan tersebut sebagai tersangka korupsi sesuai dengan aturan hukum?,"Ya, mahasiswa belajar."
"JAKARTA, KOMPAS.com- PresidenPrabowo Subiantomengucapkan selamat bertugas kepada 2.000perwira remajayang baru saja dilantik secara langsung di Istana Merdeka, Kompleks Istana Kepresidenan, Jakarta Pusat, Rabu (23/7/2025).
Ia berpesan agar para perwira remaja rela mengabdi untuk negara dan bangsa. Ia pun mengingatkan agar para perwira menjadi polisi dan tentara yang membela rakyat.
""Jadilah tentara rakyat, tentara nasional, tentara pejuang. Jadilah polisi rakyat, polisi nasional, polisi pejuang selalu membela rakyatmu, selalu cintai rakyatmu, kau adalah anak kandung dari rakyat Indonesia,"" kata Prabowo menyampaikan amanat dalam upacara pelantikan, Rabu.
Baca juga:Prabowo Sematkan Penghargaan kepada 8 Peraih Adhi Makayasa saat Melantik Capaja
Prabowo mengingatkan, ribuan tentara dan polisi itu telah mengucapkan janji yang suci, yang disaksikan oleh Tuhan dan seluruh rakyat.
Mereka harus menjadi perwiraTNI/Polridengan sungguh-sungguh. Lewat sumpah itu, mereka telah menyatakan rela berkorban jiwa dan raga untuk membela negara dan bangsa.
""Tolonglah dihayati dan disimak apa yang telah saudara ucapkan. Hari ini di hadapan seluruh rakyat, di hadapan Tuhan yang Maha Besar, saudara telah menyatakan merelakan jiwa dan ragamu untuk bangsa dan negara,"" bebernya.
Mantan Menteri Pertahanan (Menhan) menyebut, perwira remaja adalah putra dan putri terbaik bangsa.
Baca juga:Prabowo Lantik 2.000 Capaja di Istana Merdeka Hari Ini, Siap Berkorban Jiwa Raga
Lebih lanjut ia menjelaskan, kedaulatan dan kehormatan bangsa, serta keselamatan rakyat ada di pundak para perwira. Oleh sebab itu, kehadiran para perwira akan diharapkan dan dinantikan oleh rakyat.
""Pengabdian, baktimu, dan bila perlu pengorbananmu yang terakhir,"" tandasnya.
Sebagai informasi, para Capaja merupakan taruna dan taruni tingkat akhir dari empat akademi, yakni Akademi Militer (Akmil), Akademi Angkatan Laut (AAL), Akademi Angkatan Udara (AAU), dan Akademi Kepolisian (Akpol).
Capaja terdiri dari 827 orang dari Akademi Militer (Akmil), 433 orang dari Akademi Angkatan Laut (AAL), 293 orang dari Akademi Angkatan Udara (AAU), dan 447 orang dari Akademi Kepolisian (Akpol).
Baca juga:Ada Pelantikan Praspa TNI-Polri di Istana, Arus Lalu Lintas Dialihkan Sejak Pagi
Sebelum dilantik, para Capaja telah lebih dulu mendapat pembekalan dari Panglima TNI Agus Subiyanto di Gedung Olahraga (GOR) A. Yani, Mabes TNI, Cilangkap, Jakarta Timur, Jumat (18/7/2025).
Agus meminta Capaja menjadi agen perubahan di satuan masing-masing dan garda terdepan dalam menjaga nilai-nilai Pancasila.
Pembekalan ini merupakan bagian dari rangkaian menuju Upacara Prasetya Perwira (Praspa) pada 23 Juli 2025, sebuah tonggak awal pengabdian para Capaja sebagai perwira pertama di lingkungan TNI dan Polri.
""Saya berharap bahwa para paja nanti bisa menjadi agen perubahan, memajukan satuan dan masyarakat di sekelilingmu dengan bekal pengetahuan, kreativitas, dan inovasi. Kemudian sebagai penjaga nilai dan menjadi garda terdepan dalam menjaga nilai-nilai Pancasila sebagai pemersatu bangsa dan negara,"" kata Agus dalam keterangannya, Jumat.",Kapan Prabowo menyampaikan amanat?,Rabu (23/7/2025)
