content,question,answer
"JAKARTA, KOMPAS.com- Setelah sempat viral karena bergabung dengan Kementerian Pertahanan Rusia untuk menjadi tentara bayaran, eks prajurit MarinirSatria Arta Kumbarakembali menjadi perhatian karena minta dipulangkan ke Indonesia.
Melalui akun TikTok @zstorm689 pada Minggu (20/7/2025), Satria menyampaikan pesan terbuka kepada Presiden Prabowo Subianto, Wakil Presiden Gibran Rakabuming Raka, dan Menteri Luar Negeri Sugiono.
Dalam pesannya, Satria memohon maaf atas ketidaktahuannya yang menyebabkan pencabutan status kewarganegaraan Indonesia akibat kontrak dengan Kementerian Pertahanan Rusia.
""Mohon izin Bapak. Saya ingin memohon maaf sebesar-besarnya apabila ketidaktahuan saya menandatangani kontrak dengan Kementerian Pertahanan Rusia mengakibatkan dicabutnya warga negara saya,"" ujar Satria.
Dalam video itu, dia juga menegaskan tidak pernah berniat mengkhianati negara. Keputusan untuk bergabung dengan militer asing semata-mata didorong oleh kebutuhan ekonomi.
Baca juga:Eks Marinir Satria Arta Minta Pulang, TNI AL Tegaskan Sudah Diberhentikan Tidak Hormat
""Saya niatkan datang ke sini (Rusia) hanya untuk mencari nafkah.Wakafa Billahi, cukuplah Allah sebagai saksi,"" kata Satria.
Namun, setelah menjalani hidup sebagai tentara bayaran, Satria menyadari bahwa pencabutan kewarganegaraan Indonesia merupakan konsekuensi berat.
Oleh karena itu, dia memohon bantuan untuk mengakhiri kontrak dengan Rusia dan memulihkan kembali statusnya sebagai warga negara Indonesia.
Dimintai tanggapan atas permintaan Satria tersebut, Kepala Dinas Penerangan TNI Angkatan Laut (Kadispenal) Laksamana Pertama Tunggul mengatakan bahwa satuannya tidak ikut campur soal keinginan Arta Kumbara pulang ke Indonesia setelah bergabung menjadi prajurit di Rusia.
Sebab, Tunggul menegaskan bahwaSatria ArtaKumbara telah diberhentikan secara tidak hormat dari dinas militer melalui putusan hukum yang sudah inkracht atau berkekuatan hukum tepat.
“Menurut saya, pertanyaan ini akan lebih tepat ditanyakan kepada Kementerian Luar Negeri RI atau Kementerian Hukum RI terkait dengan status kewarganegaraan yang bersangkutan. Yang jelas, saat ini sudah tidak ada lagi keterkaitan dengan TNI AL,” kata Tunggul kepada Kompas.com, Senin (21/7/2025).
Baca juga:Eks Marinir Satria Arta: Dulu Gabung Jadi Tentara Bayaran Rusia, Kini Menangis Minta Pulang
Kadispenal mengingatkan bahwa Satria Arta Kumbara dipecat karena dinyatakan bersalah atas tindak pidana desersi dalam waktu damai sejak 13 Juni 2022.
“Satria Arta Kumbara terbukti secara sah dan meyakinkan bersalah melakukan tindak pidana 'Desersi dalam waktu damai' terhitung mulai tanggal 13 Juni 2022 hingga saat ini,"" kata Tunggul.
Putusan tersebut dibacakan oleh Pengadilan Militer II-08 Jakarta pada 6 April 2023 dalam perkara Nomor 56-K/PM.II-08/AL/IV/2023, dan telah berkekuatan hukum tetap (AMKHT) sejak 17 April 2023.
Kemudian, eks anggota marinir tersebut dijatuhi hukuman penjara selama 1 tahun, disertai tambahan hukuman berupa pemecatan dari dinas militer.",Apa keputusan utama yang ditandai oleh eks Marinir Satria?,Tidak pernah berniat mengkhianati negara. Keputusan untuk bergabung didorong oleh kebutuhan ekonomi.
"JAKARTA, KOMPAS.com- Menteri Koordinator Pemberdayaan Masyarakat (Menko PM) Muhaimin Iskandar menegaskan, masyarakat yang merasa masih layak menjadi Peserta Bantuan Iuran Jaminan Kesehatan Nasional (PBI JKN) namun tercoret dari daftar penerima bantuan dapat mengajukan reaktivasi.
Cak Imin, sapaan akrabnya mengatakan, pengajuan reaktivasi itu dapat dilakukan dengan masyarakat mendatangi Dinas Sosial setempat dengan membawa persyaratan yang dibutuhkan untuk dilakukan verifikasi.
“Kalau ada masyarakat yang benar-benar dalam data tercoret tidak mendapatkan PBI padahal sebetulnya dia miskin. Itu bisa direaktivasi,” kata Cak Imin, dalam keterangan resmi, Selasa (22/7/2025).
Baca juga:Cak Imin Harap Produsen Dalam Negeri Lebih Kompetitif Usai AS Beri Tarif Impor 19 Persen
Ia menuturkan, pengajuan reaktivasi PBI JKN tersebut sebagai upayasinkronisasi dataagar pemberian bantuan dari pemerintah tepat sasaran.
Namun, Cak Imin menegaskan, hak-hakmasyarakat miskinuntuk menerima bantuan dari pemerintah harus dipenuhi sesuai amanat undang-undang.
Oleh karena itu, lanjut dia, Kemenko PM akan berkoordinasi dengan Kementerian/Lembaga untuk memastikan hak masyarakat miskin menerima bantuan.
“Jadi, yang merasa miskin memang layak dapat bantuan Iuran BPJS Kesehatan. Itu bisa komplain. Nanti Dinas Sosial akan melakukan reaktivasi. Kalau memang benar-benar membutuhkan,” ujar dia.
Baca juga:Eks Marinir Satria Arta: Dulu Gabung Jadi Tentara Bayaran Rusia, Kini Menangis Minta Pulang
Dirut BPJS Kesehatan Ali Ghufron mengatakan, perubahan data PBI JKN yang terjadi adalah dampak upaya pemerintah melakukan sinkronisasi data melalui Data Tunggal Sosial dan Ekonomi Nasional (DTSEN).
Ia mengatakan, sinkronisasi data itu adalah tindak lanjut amanat Presiden Prabowo Subianto melalui Inpres 4/2025 tentang DTSEN.
“Maka jika sakit tidak perlu khawatir. Langsung kita aktivasi,” ujar Ghufron.",Bagaimana Cak Imin menegaskan masyarakat yang tidak tercoret dari daftar penerima PBI JKN?,-
"JAKARTA, KOMPAS.com- Anggota Komisi IX DPR RINetty Prasetiyani Ahermengaku prihatin terkait temuan 15 produk obat bahan alam (OBA) yang diketahui mengandungbahan kimiaobat (BKO) berbahaya.
Salah satunya adalah sildenafil sitrat.
Netty mengatakan, temuan ini sangat mengkhawatirkan karena dapat membahayakan keselamatan masyarakat sebagai konsumen.
Baca juga:BPOM Rilis Daftar 15 Obat Herbal dan Suplemen dari Negara Lain yang Mengandung BKO
""Temuan ini sangat memprihatinkan.Obat herbalseharusnya menjadi alternatif yang aman bagi masyarakat, bukan malah menjadi ancaman karena disusupi bahan kimia obat tanpa izin,"" kata Netty, dalam keterangannya, Selasa (22/7/2025).
Netty menekankan pentingnya pengawasan ketatBPOMyang mencakup seluruh rantai produksi, mulai dari produsen, pemasok bahan baku, hingga distribusi.
""BPOM tidak boleh hanya reaktif karena adanya kasus. Pengawasan proaktif dan inspeksi berkala harus ditingkatkan,"" kata Netty.
Legislator dari Dapil Jawa Barat VIII itu menuturkan, masyarakat juga perlu diberi literasi agar lebih cermat sebelum membeli produk herbal.
Baca juga:BPOM Ungkap 61 Obat Herbal yang Mengandung Bahan Kimia, Bisa Picu Kerusakan Hati
Pasalnya, penggunaan bahan kimia seperti sildenafil tanpa pengawasan dokter bisa menimbulkan dampak serius bagi kesehatan masyarakat.
""Jika disalahgunakan dalam produk herbal tanpa izin, ini jelas pelanggaran hukum dan etika kesehatan,"" ujarnya.
Netty mendukung langkah tegas BPOM yang telah menarik serta memusnahkan produk-produk berbahaya tersebut dari pasaran.
""Kesehatan publik tidak boleh dikorbankan karena ambisi bisnis. Saya mendorong BPOM, Kementerian Kesehatan, dan stakeholder terkait untuk membuat sistem yang tidak memberi celah bagi pelaku usaha yang curang,"" papar Netty.
Baca juga:BPOM Ungkap Daftar Obat Herbal Produksi Klaten dan Kudus yang Bisa Merusak Hati dan Jantung
Seperti diketahui, BPOM menarik 15 produk obat tradisional ilegal yang ditemukan mengandung zat kimia keras yang seharusnya hanya bisa dikonsumsi dengan resep dokter sepanjang Juni 2025.
Dalam uji laboratorium, sederet obat tradisional yang ternyata dioplos dengan bahan kimia keras beredar luas, terutama secara online.
Selain sildenafil, BPOM juga menemukan kandungan lain seperti deksametason, parasetamol, klorfeniramin maleat, hingga sibutramin HCl.
Semua zat tersebut termasuk obat keras yang tidak boleh dikonsumsi tanpa pengawasan tenaga medis.",Apa produk obat herbal yang terdapat dalam temuan ini?,"Sildenafil sitrat.

Pertanyaan: Mengapa ditemui mengejutkan bagi masyarakat sebagai pemilik peralatan tubuh (PTT)?
Jawaran: Karena itu bisa membahayakan keselamatan orang dan mengancam kesehatan jika digunakan tanpa izin.

Pertanyaan: Apa cara Netty menyarankan untuk memperingati pemilik peralatan tubuh?
Jawaran: Mengharuskan seluruh rantai produksi, dari produsen hingga distribusi, berhubungan dengan obat herbalnya.

Pertanyaan: Apa kebutuhan Netty untuk pengawasan terhadap peralatan tubuh?
Jawaran: Pengawasi proaktif dan inspeksi berkala harus ditingkatkan, tidak boleh hanya reaktif."
"JAKARTA, KOMPAS.com- Menko Pemberdayaan Masyarakat (PM) sekaligus Ketum PKBMuhaimin Iskandar(Cak Imin) mendoakan hukuman Menteri Perdagangan (Mendag) periode 2015-2016, Thomas Trikasih Lembong alias Lembong dihapus oleh Pengadilan Tinggi pada tingkat banding.
""Ya saya berdoa terus, saya sudah sempat nengokTom Lembong. Saya juga berharap, sebagai sahabat, keadilan akan ditunjukkan di banding,"" ujar Cak Imin di Hotel Sahid, Jakarta, Selasa (22/7/2025) malam.
""Mudah-mudahan bisa dihapus di banding, moga-moga kita doakan,” katanya lagi.
Dalam kesempatan itu, Cak Imin juga mengaku bahwa dirinya terus mendukung Tom Lembong yang pernah menjadi Co-Captain Tim Pemenangan Nasional (Timnas) Anies Baswedan-Muhaimin Iskandar pada Pemilihan Presiden (Pilpres) 2024.
""Pasti, saya melakukan komunikasi terus dengan Tom,” ujar Cak Imin.
Baca juga:Mahfud Bicara Vonis Tom Lembong: Tak Ada Mens Rea sampai Tak Bisa Dipidana
Diketahui, Tom Lembong dijatuhi vonis 4,5 tahun penjara dan denda Rp 750 juta subsidair enam bulan kurungan.
Dalam putusannya, majelis hakim menyatakan Tom Lembong terbukti bersalah melakukan tindak pidana korupsi sebagaimana dakwaan primair jaksa penuntut umum, yakni Pasal 2 atau Pasal 3 jo Pasal 18 Undang-Undang Nomor 31 Tahun 1999 tentang Pemberantasan Tindak Pidana Korupsi jo Pasal 55 ayat (1) ke-1 KUHP.
Namun, dalam putusannya, majelis hakim tidak menjatuhkan pidana uang pengganti karena Tom Lembong dinilai menikmati hasil tindak pidana korupsi dari kebijakan importasi gula di Kemendag tahun 2015-2016.
""Kepada terdakwa tidak dikenakan ketentuan Pasal 18 Ayat 1 Huruf b UU Tipikor karena faktanya terdakwa tidak memeroleh harta benda dari tindak pidana korupsi yang dilakukan oleh terdakwa,” kata hakim anggota Alfis Setiawan dalam sidang pembacaan putusan di Pengadilan Tipikor, Jakarta, Jumat.
Baca juga:Cak Imin Doakan Tom Lembong Dapat Keadilan di Tingkat Banding
Merespons putusan 4,5 tahun penjara tersebut, Tom Lembong resmi mengajukan banding.
Kuasa hukum Tom Lembong, Zaid Mushafi menilai, pertimbangan majelis hakim menurut nalar hukum tidak sesuai dengan fakta persidangan.
“Insya Allah hari ini kami akan resmi memasukkan dokumen pernyataan banding atas kasus, atas putusan Pak Tom Lembong,” kata Zaid saat ditemui di Pengadilan Tipikor Jakarta Pusat, Selasa (22/7/2025).
Zaid mengatakan, permohonan banding diadili olehjudex factiatau majelis yang memeriksa fakta persidangan.
Melalui upaya hukum ini, tim kuasa hukum akan membantah pendapat yang disampaikan hakim dalam pertimbangan putusannya.
“Apa saja yang menjadi pertimbangan oleh majelis hakim akan kita bantah dalam memori banding ini,” ujar Zaid.
Baca juga:Cak Imin Doakan Tom Lembong Dapat Keadilan di Tingkat Banding",Apakah Cak Imin berpendapat bahwa Tom Lembong akan menjadi pemilu penentang juri di banding?,"Tidak, karena tom siapa-siapa yang terlibat dalam kepolisian."
"KINItidak asing lagi melihat sarjana rela melamar sebagai petugas kebersihan. Lulusan S2, bahkan S3 bekerja sebagai pengemudi ojek daring atau kurir makanan, sambil mengambil pekerjaan lepas demi bertahan hidup.
Di tempat lain, tak jarang seorang asisten rumah tangga, penjaga toko, kasir, hingga satpam ternyata pernah duduk di bangku kuliah atau merupakan pemegang ijazah sarjana.
Cerita-cerita semacam ini terus bermunculan, dan bukan lagi pengecualian, melainkan cerminan dari kondisi struktural yang lebih dalam, ketika gelar pendidikan tinggi tidak lagi menjamin pekerjaan yang setara dengan kualifikasinya.
Selama dua dekade terakhir, ironisnya Indonesia mencatat ekspansi besar dalam pendidikan tinggi. Tingkat partisipasi kasar (gross enrollment rate) mencapai 39,4 persen pada 2024, lonjakan signifikan meski masih tertinggal dari negara tetangga seperti Singapura, Thailand, dan Malaysia (Brodjonegoro, 2024).
Namun, peningkatan akses ini tidak serta-merta berbanding lurus dengan keterlibatan angkatan muda di pasar kerja.
Baca juga:Benarkah Link and Match Masalah Perguruan Tinggi?
Data SUSENAS menunjukkan bahwa tingkat inaktivitas kerja pada kelompok usia 25–34 tetap tinggi, bahkan di kalangan lulusan pendidikan tinggi, dengan angka fluktuatif antara 17 hingga 22 persen selama 2022–2024.
Lebih mencemaskan, data Kementerian Ketenagakerjaan dan BPS pada 2025 menunjukkan bahwa dari total 7,28 juta penganggur di Indonesia, sebanyak 1,01 juta di antaranya adalah lulusan pendidikan tinggi.
Artinya, sekitar 13 persen pengangguran nasional justru datang dari kalangan yang secara teoritis paling siap memasuki dunia kerja.
Ini mengindikasikan bahwa universitas telah menjadi pabrik gelar yang melepas lulusan tanpa arah. Negara dan kampus tampak hanya berpikir sektoral—mengejar angka partisipasi pendidikan tanpa menciptakan ekosistem transisi dari kampus ke dunia kerja.
Fenomena ini menunjukkan bahwa gelar akademik, meski masih berguna, kian kehilangan daya protektifnya, terutama di tengah ketimpangan struktural, saturasilapangan kerja, dan lemahnya keterkaitan antara sistem pendidikan dan kebutuhan riil pasar.
Inflasi kredensial (credential inflation) terjadi ketika semakin banyak orang memperoleh gelar pendidikan tinggi, tetapi jumlah pekerjaan yang mensyaratkan gelar tersebut tidak bertambah sepadan.
Akibatnya, gelar kehilangan kelangkaannya, dan bersama itu, pun daya tawarnya di pasar kerja.
Namun, dalam masyarakat dengan struktur ekonomi dan pasar kerja yang lebih kompleks, kita mulai menyaksikan fenomena lebih tajam, yaitu krisis kredensialisme.
Ini adalah kondisi ketika gelar pendidikan tinggi tidak hanya kehilangan nilainya karena secara kuantitas melimpah, tetapi karena kualitasnya mulai dipertanyakan.
Pasar mulai mengabaikan simbol dan lebih mencari substansi, yakni keterampilan aktual, kapasitas nyata, dan pengalaman konkret.
Meski pendidikan tinggi masih terbukti menurunkan risiko menjadi NEET (Not in Employment, Education, or Training) hingga 60 persen, efektivitasnya sangat bergantung pada konteks wilayah.
Data menunjukkan bahwa tinggal di daerah dengan IPM tinggi tidak secara signifikan mengurangi risiko NEET.
Sementara tinggal di wilayah miskin justru sedikit menurunkannya, kemungkinan karena tekanan ekonomi yang mendorong orang bekerja apa pun pekerjaannya.
Yang lebih penting, efek protektif dari pendidikan tinggi justru melemah di dua kutub wilayah ini, baik di daerah maju maupun tertinggal, nilai gelar mengalami erosi.
Baca juga:Rojali dan Krisis Dompet Rakyat",Apakah semua sarjana rela melamar sebagai petugas kebersihan?,"Tidak, karena juga bekerja secara daring atau kurir."
"JAKARTA, KOMPAS.com -Mantan Menko PolhukamMahfud MDmenyoroti hakim yang menyebut Mantan Menteri Perdagangan Thomas Trikasih Lembong aliasTom Lembongmengedepankan ekonomi kapitalis dalam vonis kasus impor gula.
Menurut dia, hakim tidak bisa membedakan ideologi dan norma hukum saat menyusun putusan.
""Hakim juga bercanda lucu bahwa salah satu yang memberatkan Tom Lembong adalah membuat kebijakan yang kapitalistik. Tampaknya hakim tak paham bedanya ide dan norma,"" ujar Mahfud kepada Kompas.com, Selasa (22/7/2025).
Baca juga:Mahfud Sentil Hakim yang Hitung Sendiri Kerugian Negara di Kasus Tom Lembong: BPKP Dinilai Tak Benar
Mahfud juga menyentil hakim yang menghitung kerugian negara sendiri.
Mahfud heran hakim tersebut malah tidak percaya dengan hasil perhitungan kerugian negara dari Badan Pengawasan Keuangan dan Pembangunan (BPKP).
""Selain kelemahan dari sudut mens rea, vonis untuk Tom Lembong juga tidak menunjukkan rangkaian logis tentang actus reus yang bisa dibuktikan. Kelemahan lain, perhitungan kerugian negara yang resmi dibuat oleh BPKP dinilai tidak benar sehingga majelis hakim membuat hitungan dengan matematikanya sendiri,"" ujar Mahfud.
Sebelumnya, Majelis hakim menilai perbuatan Menteri Perdagangan 2015-2016 Thomas Trikasih Lembong alias Tom Lembong dalam kasus impor gula hanya mengedepankan ekonomi kapitalis, alih-alih ekonomi Pancasila.
Baca juga:Mahfud Nilai Putusan MK Kembali Munculkan Wacana Kepala Daerah Dipilih DPRD
""Terdakwa pada saat menjadi Menteri Perdagangan kebijakan menjaga ketersediaan gula nasional dan stabilitas harga gula nasional lebih mengedepankan ekonomi kapitalis, dibandingkan sistem demokrasi ekonomi dan sistem Pancasila berdasarkan kesejahteraan umum dan keadilan sosial,"" ungkap hakim saat membacakan hal-hal yang memberatkan tindakan Tom Lembong dalam sidang putusan di Pengadilan Tipikor Jakarta, Jumat (18/7/2025).
Selain itu, Tom Lembong juga dinilai tidak melaksanakan asas kepastian hukum dan meletakkan hukum dengan ketentuan peraturan perundang-undangan sebagai dasar pengambilan setiap kebijakan dalam pengendalian harga gula, ketika menjabat sebagai Menteri Perdagangan.
Hakim juga menilai, Tom Lembong tidak melaksanakan tugas dan tanggung jawab secara akuntabel, bermanfaat dan adil dalam pengendalian stabilitas harga gula yang murah dan terjangkau oleh masyarakat sebagai konsumen terakhir atau bahan kebutuhan pokok berupa gula kristal putih (GKP).
""Keempat, terdakwa pada saat menjadi Menteri Perdagangan telah mengabaikan masyarakat sebagia konsumen akhir gula kristal putih untuk mendapatkan gula kristal putih dengan Harga yang terjangkau,"" ungkap hakim.
Baca juga:Mahfud MD: Tom Lembong Hanya Laksanakan Tugas dari Atas
Dalam putusannya, hakim menyatakan Tom Lembong terbukti secara sah dan meyakinkan bersalah melakukan tindak pidana korupsi bersama-sama sebagaimana dalam dakwaan primair.
""Menjatuhkan pidana kepada terdakwa Thomas Trikasih Lembong dengan pidana penjara selama 4 tahun dan 6 bulan,"" kata hakim.
""Menjatuhkan pidana kepada Terdakwa sebesar Rp 750 juta dengan ketentuan apabila denda tidak dibayar diganti dengan pidana kurungan selama 6 bulan,"" imbuh hakim.",Apa ideologi dan norma hukum yang terus menyebabkan putusan hakim dalam kasus impor gula?,Kapitalistik
"JAKARTA, KOMPAS.com- Direktur Eksekutif Trias Politika Strategis Agung Baskoro berpandangan bahwa keakraban yang diperlihatkan PresidenPrabowoSubianto dan Presiden ke-7 RI Joko Widodo (Jokowi) di Solo akhir pekan lalu, adalah bentuk penegasan keduanya bahwa hubungan mereka sangat baik.
Bahkan, menurut Agung, keakraban itu diperlihatkan untuk membantah rumor bahwa hubungan Prabowo dan Jokowi telah merenggang.
""PertemuanPresiden Prabowodengan Pak Jokowi kemarin di Solo menegaskan bahwa relasi keduanya sangat baik bahkan begitu hangat. Sekaligus membantah rumor yang dihembuskan pihak-pihak di seberang kekuasaan yang menyakini hubungan Presiden ke-8 dengan Presiden ke-7 renggang,” kata Agung kepada Kompas.com, Selasa (22/7/2025).
Selain itu, Agung menyebut, keakraban itu sekaligus upaya menjaga keseimbangan politik ke semua poros kekuasaan.
Baca juga:1 Jam Bertemu Jokowi, Prabowo Cerita Hasil Kunker Luar Negeri
“Arahan Presiden Prabowo menjaga relasi dengan Pak Jokowi ini menegaskan konsistensi narasi beliau yang ingin merangkul semua sekaligus menjaga keseimbangan politik (balance of powers) ke semua poros kekuasaan,” ujarnya.
Diketahui, Prabowo langsung sowan ke rumah Jokowi begitu tiba di Solo, Jawa Tengah pada Minggu, 20 Juli 2025.
Kehadiran Prabowo ke Solo untuk menghadiri Kongres Partai Solidaritas Indonesia (PSI) di Gedung Edutorium KH Ahmad Dahlan Universitas Muhammadiyah Surakarta (UMS), Jawa Tengah.
Saat itu, Jokowi dan Iriana Jokowi langsung menyambut Prabowo di depan pintu gerbang.
Prabowo pun terpantau berada di rumah Jokowi selama sekitar satu jam. Setelah itu, menuju lokasi acara Kongres PSI.
Baca juga:Keakraban Prabowo-Jokowi di Solo, Tepis Isu Pecah Kongsi?
Tak berhenti sampai di situ, Prabowo dan Jokowi makan bersama di Bakmi Joko Bu Citro 1, Solo.
Acara makan bersama ini dilakukan usai Prabowo menghadiri Kongres PSI.
Namun, acara makan bakmi ini juga dihadiri oleh Wakil Presiden (Wapres) yang juga putra sulung Jokowi, Gibran Rakabuming Raka. Kemudian, Kepala Badan Pengendalian Pembangunan dan Investigasi Khusus (Bappisus) Aris Marsudiyanto.
Selain itu, sejumlah Menteri Kabinet Merah Putih juga ikut dalam acara makan bersama. Di antaranya, Sekretaris Kabinet (Seskab) Letkol Teddy Indra Wijaya, Menteri Luar Negeri Sugiono, dan Menteri Sekretaris Negara Prasetyo Hadi.
Lalu, ada Menteri Koordinator (Menko) Pangan Zulkifli Hasan, Menteri ESDM Bahlil Lahadalia, Menteri BUMN Erick Thohir, Menteri Komunikasi dan Digital Meutya Hafid, dan Wakil Menteri Kebudayaan Giring Ganesha.
Baca juga:Soal Posisi di PSI, Jokowi: Di Depan, Belakang, Tengah juga Bisa
Keakraban Prabowo dan Jokowi kembali terlihat pada keesokan harinya, Senin, 21 Juli 2025.","Keakraban Presiden Prabowo dan Jokowi menambahkan hubungan mereka, mengapa ini dilakukan?",Untuk membantu konsistensi relasi mereka.
"JAMBI, KOMPAS.com– Video rekaman keributan antara seorangdriverojekonline(ojol) wanita dan pelanggannya di Kota Jambi viral di media sosial. Peristiwa terjadi pada Minggu (20/7/2025) dan dipicu masalah pesanan makanan yang tak kunjung dibayar.
Driverbernama Rusdewi (40) akhirnya naik ke lantai dua rumah pelanggan karena merasa dirugikan. “Saya bilang, saya ini cuman cari makan, bayar tunai saja emangnya kenapa?” kata Rusdewi saat ditemui di kediamannya, Selasa (22/7/2025).
Kompas.commenelusuri insiden ini dan mendapatkan kronologi lengkap dari Rusdewi. Ia mengatakan bahwa saat itu menerima pesanan Ayam Bakar Rempah Madu atas nama konsumen bernama Alika Alihandra.
“Saya bawa dua pesanan makanan waktu itu. Saya dahulukan pesanan dia ini (Alika) karena dia yang pesan duluan,” ujar Rusdewi.
Baca juga:Mobilnya Oleng dan Terbalik, Mahasiswa di Medan Tabrak Driver Ojol
Setibanya di Perumahan Vila Kenali, Rusdewi menyerahkan makanan dan menunggu pembayaran via QR. Namun, notifikasi tidak juga masuk ke akun Grab miliknya.
“Saya bilang belum masuk. Saya lihat dia memang lagingetik-ngetikdi HP. Biasalah kan, saya pikir jaringan. Terus saya kasih lihat layar HP (akun Grab) saya, bilang belum ada masuk,” katanya.
Setelah beberapa lama menunggu tanpa hasil, Rusdewi meminta agar pembayaran dilakukan secara tunai. Namun, konsumen bersikeras bahwa pesanannya sudah dibayar oleh orang lain.
“Awalnya dia scan barcode di aplikasi saya, ternyata dia cumafotoin. Terus dia bilang ‘Yo tunggu, saya kirim ke WA orang ni, QR mbak ni’,” kata Rusdewi menirukan ucapan pelanggan.
Menurut Rusdewi, konsumen berdalih pembayaran akan dilakukan oleh ibunya. “Tapi dia bilang, ‘Tunggu bentar, ini mami saya, mamin’ katanya gitu. Tapi saya kan masih ditunggu konsumen lain, saya bilang, kalau bisa bayar pakai tunai aja, takut saya dikomplain,” ujarnya.
Baca juga:Tak Ikut Demo Ojol, Driver: Kalau Enggak Narik, Keluarga Enggak Makan
Rusdewi mengaku menunggu selama 30 menit, namun pembayaran tidak kunjung masuk. Ia pun memutuskan mengantar pesanan lain. “Karena kan, kalau mau antar orderan yang kedua, orderan yang pertama harus selesai. Akhirnya, saya antar orderan kedua, saya minta maaf karena telat,” katanya.
Setelah mengantar pesanan berikutnya, Rusdewi kembali ke rumah pelanggan. Ia sempat meminta bantuan seorang pria untuk memanggil konsumen, namun tidak mendapat respons.
Puncaknya, Rusdewi naik ke lantai dua rumah konsumen dan terjadi perkelahian fisik. Aksi itu terekam video dan viral setelah kedua belah pihak menyebarkan klarifikasi versi masing-masing.
Keributan berakhir setelah nenek dari konsumen membayar pesanan sebesar Rp 30 ribu secara tunai.
Kompas.comjuga sempat menyambangi rumah pelanggan, namun pihak keluarga menyatakan tidak bersedia diwawancarai. Mereka mengaku telah melapor ke Polresta Jambi.","Pada tanggal (20/7/2025), apakah Rusdewi, seorang ojek di Kota Jambi yang memiliki masalah pesanan makanan dengan bayar tunai saja, mengungkapkan ada hal-hal berikut tentunya?","Dipicu perjalanan Rusdewi menjadi lebih terburuk karena dirugikan di lantai dua rumah pelanggiannya. Mereka berkomitmen untuk membeli makan, tetapi masalah adalah tidak kunjung ke tempat pembelian dan hanya mengharapkan bayaran tunai saja dibandingkan dengan pesanan yang mereka terima."
